{
  "name": "PancakeSwap Onramp",
  "timestamp": "2024-05-22T06:51:26.873Z",
  "version": {
    "major": 0,
    "minor": 0,
    "patch": 7
  },
  "logoURI": "https://pancakeswap.finance/logo.png",
  "keywords": ["pancakeswap", "onramp"],
  "tokens": [
    {
      "name": "DAI StableCoin",
      "address": "0x6B175474E89094C44Da98b954EedeAC495271d0F",
      "symbol": "DAI",
      "decimals": 18,
      "chainId": 1,
      "logoURI": "https://tokens.pancakeswap.finance/images/symbol/dai.png"
    },
    {
      "name": "USD Coin",
      "address": "0xA0b86991c6218b36c1d19D4a2e9Eb0cE3606eB48",
      "symbol": "USDC",
      "decimals": 6,
      "chainId": 1,
      "logoURI": "https://tokens.pancakeswap.finance/images/symbol/usdc.png"
    },
    {
      "name": "Tether USD",
      "address": "0xdAC17F958D2ee523a2206206994597C13D831ec7",
      "symbol": "USDT",
      "decimals": 6,
      "chainId": 1,
      "logoURI": "https://tokens.pancakeswap.finance/images/symbol/usdt.png"
    },
    {
      "name": "Binance USD",
      "address": "0xe9e7CEA3DedcA5984780Bafc599bD69ADd087D56",
      "symbol": "BUSD",
      "decimals": 18,
      "chainId": 56,
      "logoURI": "https://tokens.pancakeswap.finance/images/symbol/busd.png"
    },
    {
      "name": "Bridged USDC",
      "symbol": "USDC.e",
      "address": "0x3355df6D4c9C3035724Fd0e3914dE96A5a83aaf4",
      "chainId": 324,
      "decimals": 6,
      "logoURI": "https://tokens.pancakeswap.finance/images/zksync/0x3355df6D4c9C3035724Fd0e3914dE96A5a83aaf4.png"
    },
    {
      "name": "Tether",
      "symbol": "USDT",
      "address": "0x493257fD37EDB34451f62EDf8D2a0C418852bA4C",
      "chainId": 324,
      "decimals": 6,
      "logoURI": "https://tokens.pancakeswap.finance/images/zksync/0x493257fD37EDB34451f62EDf8D2a0C418852bA4C.png"
    },
    {
      "name": "USD Coin",
      "address": "0xaf88d065e77c8cC2239327C5EDb3A432268e5831",
      "symbol": "USDC",
      "decimals": 6,
      "chainId": 42161,
      "logoURI": "https://tokens.pancakeswap.finance/images/symbol/usdc.png"
    }
  ]
}
