{
  "name": "PancakeSwap Default Aptos List",
  "timestamp": "2022-01-26T11:45:09Z",
  "version": {
    "major": 1,
    "minor": 0,
    "patch": 0
  },
  "tags": {},
  "logoURI": "https://simpleflow.finance/logo.png",
  "keywords": ["pancake", "default", "aptos"],
  "schema": "aptos",
  "tokens": [
    {
      "name": "BNB",
      "symbol": "BNB",
      "chainId": 34,
      "decimals": 8,
      "address": "0x8c805723ebc0a7fc5b7d3e7b75d567918e806b3461cb9fa21941a9edc0220bf::devnet_coins::DevnetBNB",
      "logoURI": "https://tokens.simpleflow.finance/images/symbol/bnb.png"
    },
    {
      "name": "Bitcoin",
      "symbol": "BTC",
      "chainId": 34,
      "decimals": 8,
      "address": "0x8c805723ebc0a7fc5b7d3e7b75d567918e806b3461cb9fa21941a9edc0220bf::devnet_coins::DevnetBTC",
      "logoURI": "https://tokens.simpleflow.finance/images/symbol/wbtc.png"
    },
    {
      "name": "Dai",
      "symbol": "DAI",
      "chainId": 34,
      "decimals": 8,
      "address": "0x8c805723ebc0a7fc5b7d3e7b75d567918e806b3461cb9fa21941a9edc0220bf::devnet_coins::DevnetDAI",
      "logoURI": "https://tokens.simpleflow.finance/images/symbol/dai.png"
    },
    {
      "name": "Ethereum",
      "symbol": "ETH",
      "chainId": 34,
      "decimals": 8,
      "address": "0x8c805723ebc0a7fc5b7d3e7b75d567918e806b3461cb9fa21941a9edc0220bf::devnet_coins::DevnetETH",
      "logoURI": "https://simpleflow.finance/images/tokens/0x2170Ed0880ac9A755fd29B2688956BD959F933F8.png"
    },
    {
      "name": "USD coin",
      "symbol": "USDC",
      "chainId": 34,
      "decimals": 8,
      "address": "0x8c805723ebc0a7fc5b7d3e7b75d567918e806b3461cb9fa21941a9edc0220bf::devnet_coins::DevnetUSDC",
      "logoURI": "https://tokens.simpleflow.finance/images/symbol/usdc.png"
    },
    {
      "name": "Tether",
      "symbol": "USDT",
      "chainId": 34,
      "decimals": 8,
      "address": "0x8c805723ebc0a7fc5b7d3e7b75d567918e806b3461cb9fa21941a9edc0220bf::devnet_coins::DevnetUSDT",
      "logoURI": "https://tokens.simpleflow.finance/images/symbol/usdt.png"
    },
    {
      "name": "BNB",
      "symbol": "BNB",
      "chainId": 2,
      "decimals": 8,
      "address": "0x8c805723ebc0a7fc5b7d3e7b75d567918e806b3461cb9fa21941a9edc0220bf::devnet_coins::DevnetBNB",
      "logoURI": "https://tokens.simpleflow.finance/images/symbol/bnb.png"
    },
    {
      "name": "Bitcoin",
      "symbol": "BTC",
      "chainId": 2,
      "decimals": 8,
      "address": "0x8c805723ebc0a7fc5b7d3e7b75d567918e806b3461cb9fa21941a9edc0220bf::devnet_coins::DevnetBTC",
      "logoURI": "https://tokens.simpleflow.finance/images/symbol/wbtc.png"
    },
    {
      "name": "Dai",
      "symbol": "DAI",
      "chainId": 2,
      "decimals": 8,
      "address": "0x8c805723ebc0a7fc5b7d3e7b75d567918e806b3461cb9fa21941a9edc0220bf::devnet_coins::DevnetDAI",
      "logoURI": "https://tokens.simpleflow.finance/images/symbol/dai.png"
    },
    {
      "name": "Ethereum",
      "symbol": "ETH",
      "chainId": 2,
      "decimals": 8,
      "address": "0x8c805723ebc0a7fc5b7d3e7b75d567918e806b3461cb9fa21941a9edc0220bf::devnet_coins::DevnetETH",
      "logoURI": "https://tokens.simpleflow.finance/images/symbol/weth.png"
    },
    {
      "name": "USD coin",
      "symbol": "USDC",
      "chainId": 2,
      "decimals": 8,
      "address": "0x8c805723ebc0a7fc5b7d3e7b75d567918e806b3461cb9fa21941a9edc0220bf::devnet_coins::DevnetUSDC",
      "logoURI": "https://tokens.simpleflow.finance/images/symbol/usdc.png"
    },
    {
      "name": "Tether USD",
      "symbol": "USDT",
      "chainId": 2,
      "decimals": 8,
      "address": "0x8c805723ebc0a7fc5b7d3e7b75d567918e806b3461cb9fa21941a9edc0220bf::devnet_coins::DevnetUSDT",
      "logoURI": "https://tokens.simpleflow.finance/images/symbol/usdt.png"
    },
    {
      "name": "LayerZero - USD coin",
      "symbol": "lzUSDC",
      "chainId": 1,
      "decimals": 6,
      "address": "0xf22bede237a07e121b56d91a491eb7bcdfd1f5907926a9e58338f964a01b17fa::asset::USDC",
      "logoURI": "https://tokens.simpleflow.finance/images/symbol/usdc.png"
    },
    {
      "name": "LayerZero - Tether USD",
      "symbol": "lzUSDT",
      "chainId": 1,
      "decimals": 6,
      "address": "0xf22bede237a07e121b56d91a491eb7bcdfd1f5907926a9e58338f964a01b17fa::asset::USDT",
      "logoURI": "https://tokens.simpleflow.finance/images/symbol/usdt.png"
    },
    {
      "name": "LayerZero - Wrapped Ether",
      "symbol": "lzWETH",
      "chainId": 1,
      "decimals": 6,
      "address": "0xf22bede237a07e121b56d91a491eb7bcdfd1f5907926a9e58338f964a01b17fa::asset::WETH",
      "logoURI": "https://tokens.simpleflow.finance/images/symbol/weth.png"
    },
    {
      "name": "Celer - USD Coin",
      "symbol": "ceUSDC",
      "chainId": 1,
      "decimals": 6,
      "address": "0x8d87a65ba30e09357fa2edea2c80dbac296e5dec2b18287113500b902942929d::celer_coin_manager::UsdcCoin",
      "logoURI": "https://tokens.simpleflow.finance/images/symbol/usdc.png"
    },
    {
      "name": "Celer - Tether USD",
      "symbol": "ceUSDT",
      "chainId": 1,
      "decimals": 6,
      "address": "0x8d87a65ba30e09357fa2edea2c80dbac296e5dec2b18287113500b902942929d::celer_coin_manager::UsdtCoin",
      "logoURI": "https://tokens.simpleflow.finance/images/symbol/usdt.png"
    },
    {
      "name": "Celer - Dai Stablecoin",
      "symbol": "ceDAI",
      "chainId": 1,
      "decimals": 8,
      "address": "0x8d87a65ba30e09357fa2edea2c80dbac296e5dec2b18287113500b902942929d::celer_coin_manager::DaiCoin",
      "logoURI": "https://tokens.simpleflow.finance/images/symbol/dai.png"
    },
    {
      "name": "Celer - Wrapped Ether",
      "symbol": "ceWETH",
      "chainId": 1,
      "decimals": 8,
      "address": "0x8d87a65ba30e09357fa2edea2c80dbac296e5dec2b18287113500b902942929d::celer_coin_manager::WethCoin",
      "logoURI": "https://tokens.simpleflow.finance/images/symbol/weth.png"
    },
    {
      "name": "Celer - Wrapped BTC",
      "symbol": "ceWBTC",
      "chainId": 1,
      "decimals": 8,
      "address": "0x8d87a65ba30e09357fa2edea2c80dbac296e5dec2b18287113500b902942929d::celer_coin_manager::WbtcCoin",
      "logoURI": "https://tokens.simpleflow.finance/images/symbol/wbtc.png"
    },
    {
      "name": "Celer - Binance Coin",
      "symbol": "ceBNB",
      "chainId": 1,
      "decimals": 8,
      "address": "0x8d87a65ba30e09357fa2edea2c80dbac296e5dec2b18287113500b902942929d::celer_coin_manager::BnbCoin",
      "logoURI": "https://tokens.simpleflow.finance/images/symbol/bnb.png"
    },
    {
      "name": "Celer - Binance USD",
      "symbol": "ceBUSD",
      "chainId": 1,
      "decimals": 8,
      "address": "0x8d87a65ba30e09357fa2edea2c80dbac296e5dec2b18287113500b902942929d::celer_coin_manager::BusdCoin",
      "logoURI": "https://tokens.simpleflow.finance/images/symbol/busd.png"
    },
    {
      "name": "Wormhole - Binance USD",
      "symbol": "whBUSD",
      "chainId": 1,
      "decimals": 8,
      "address": "0xccc9620d38c4f3991fa68a03ad98ef3735f18d04717cb75d7a1300dd8a7eed75::coin::T",
      "logoURI": "https://tokens.simpleflow.finance/images/symbol/busd.png"
    },
    {
      "name": "Wormhole - Wrapped Ether",
      "symbol": "whWETH",
      "chainId": 1,
      "decimals": 8,
      "address": "0xcc8a89c8dce9693d354449f1f73e60e14e347417854f029db5bc8e7454008abb::coin::T",
      "logoURI": "https://tokens.simpleflow.finance/images/symbol/weth.png"
    },
    {
      "name": "Wormhole - USD Coin",
      "symbol": "whUSDC",
      "chainId": 1,
      "decimals": 6,
      "address": "0x5e156f1207d0ebfa19a9eeff00d62a282278fb8719f4fab3a586a0a2c0fffbea::coin::T",
      "logoURI": "https://tokens.simpleflow.finance/images/symbol/usdc.png"
    },
    {
      "name": "PancakeSwap Token",
      "symbol": "CAKE",
      "chainId": 1,
      "decimals": 8,
      "address": "0x159df6b7689437016108a019fd5bef736bac692b6d4a1f10c941f6fbb9a74ca6::oft::CakeOFT",
      "logoURI": "https://tokens.simpleflow.finance/images/aptos/0x159df6b7689437016108a019fd5bef736bac692b6d4a1f10c941f6fbb9a74ca6::oft::CakeOFT.png"
    }
  ]
}
