{
  "name": "PancakeSwap Zksync Default",
  "timestamp": "2024-06-21T13:12:18.339Z",
  "version": {
    "major": 1,
    "minor": 0,
    "patch": 24
  },
  "logoURI": "https://pancakeswap.finance/logo.png",
  "keywords": ["pancakeswap", "default", "zksync"],
  "tokens": [
    {
      "name": "PancakeSwap Token",
      "symbol": "CAKE",
      "address": "0x3A287a06c66f9E95a56327185cA2BDF5f031cEcD",
      "chainId": 324,
      "decimals": 18,
      "logoURI": "https://tokens.pancakeswap.finance/images/zksync/0x3A287a06c66f9E95a56327185cA2BDF5f031cEcD.png"
    },
    {
      "name": "Wrapped Ether",
      "symbol": "WETH",
      "address": "0x5AEa5775959fBC2557Cc8789bC1bf90A239D9a91",
      "chainId": 324,
      "decimals": 18,
      "logoURI": "https://tokens.pancakeswap.finance/images/zksync/0x5AEa5775959fBC2557Cc8789bC1bf90A239D9a91.png"
    },
    {
      "name": "USD Coin (Native)",
      "symbol": "USDC",
      "address": "0x1d17CBcF0D6D143135aE902365D2E5e2A16538D4",
      "chainId": 324,
      "decimals": 6,
      "logoURI": "https://tokens.pancakeswap.finance/images/zksync/0x1d17CBcF0D6D143135aE902365D2E5e2A16538D4.png"
    },
    {
      "name": "Bridged USDC",
      "symbol": "USDC.e",
      "address": "0x3355df6D4c9C3035724Fd0e3914dE96A5a83aaf4",
      "chainId": 324,
      "decimals": 6,
      "logoURI": "https://tokens.pancakeswap.finance/images/zksync/0x3355df6D4c9C3035724Fd0e3914dE96A5a83aaf4.png"
    },
    {
      "name": "Rocket Pool ETH",
      "symbol": "rETH",
      "address": "0x32Fd44bB869620C0EF993754c8a00Be67C464806",
      "chainId": 324,
      "decimals": 18,
      "logoURI": "https://tokens.pancakeswap.finance/images/zksync/0x32Fd44bB869620C0EF993754c8a00Be67C464806.png"
    },
    {
      "name": "USD Plus",
      "symbol": "USD+",
      "address": "0x8E86e46278518EFc1C5CEd245cBA2C7e3ef11557",
      "chainId": 324,
      "decimals": 6,
      "logoURI": "https://tokens.pancakeswap.finance/images/zksync/0x8E86e46278518EFc1C5CEd245cBA2C7e3ef11557.png"
    },
    {
      "name": "Tether USD",
      "symbol": "USDT",
      "address": "0x493257fD37EDB34451f62EDf8D2a0C418852bA4C",
      "chainId": 324,
      "decimals": 6,
      "logoURI": "https://tokens.pancakeswap.finance/images/zksync/0x493257fD37EDB34451f62EDf8D2a0C418852bA4C.png"
    },
    {
      "name": "Binance USD",
      "symbol": "BUSD",
      "address": "0x2039bb4116B4EFc145Ec4f0e2eA75012D6C0f181",
      "chainId": 324,
      "decimals": 18,
      "logoURI": "https://tokens.pancakeswap.finance/images/zksync/0x2039bb4116B4EFc145Ec4f0e2eA75012D6C0f181.png"
    },
    {
      "name": "Wrapped BTC",
      "symbol": "WBTC",
      "address": "0xBBeB516fb02a01611cBBE0453Fe3c580D7281011",
      "chainId": 324,
      "decimals": 8,
      "logoURI": "https://tokens.pancakeswap.finance/images/zksync/0xBBeB516fb02a01611cBBE0453Fe3c580D7281011.png"
    },
    {
      "name": "TES",
      "symbol": "TES",
      "address": "0xCab3F741Fa54e79E34753B95717b23018332b8AC",
      "chainId": 324,
      "decimals": 18,
      "logoURI": "https://tokens.pancakeswap.finance/images/zksync/0xCab3F741Fa54e79E34753B95717b23018332b8AC.png"
    },
    {
      "name": "Wrapped liquid staked Ether 2.0",
      "symbol": "wstETH",
      "address": "0x703b52F2b28fEbcB60E1372858AF5b18849FE867",
      "chainId": 324,
      "decimals": 18,
      "logoURI": "https://tokens.pancakeswap.finance/images/zksync/0x703b52F2b28fEbcB60E1372858AF5b18849FE867.png"
    },
    {
      "name": "Zeek Coin",
      "symbol": "MEOW",
      "address": "0x79db8c67d0c33203da4Efb58F7D325E1e0d4d692",
      "chainId": 324,
      "decimals": 18,
      "logoURI": "https://tokens.pancakeswap.finance/images/zksync/0x79db8c67d0c33203da4Efb58F7D325E1e0d4d692.png"
    },
    {
      "name": "DAI Stablecoin",
      "symbol": "DAI",
      "address": "0x4B9eb6c0b6ea15176BBF62841C6B2A8a398cb656",
      "chainId": 324,
      "decimals": 18,
      "logoURI": "https://tokens.pancakeswap.finance/images/zksync/0x4B9eb6c0b6ea15176BBF62841C6B2A8a398cb656.png"
    },
    {
      "name": "Wrapped Ether Native Bridge",
      "symbol": "WETH.e",
      "address": "0xf00DAD97284D0c6F06dc4Db3c32454D4292c6813",
      "chainId": 324,
      "decimals": 18,
      "logoURI": "https://tokens.pancakeswap.finance/images/zksync/0xf00DAD97284D0c6F06dc4Db3c32454D4292c6813.png"
    },
    {
      "name": "Gravita Debt Token",
      "symbol": "GRAI",
      "address": "0x5FC44E95eaa48F9eB84Be17bd3aC66B6A82Af709",
      "chainId": 324,
      "decimals": 18,
      "logoURI": "https://tokens.pancakeswap.finance/images/zksync/0x5FC44E95eaa48F9eB84Be17bd3aC66B6A82Af709.png"
    },
    {
      "name": "USDT+",
      "symbol": "USDT+",
      "address": "0xBb8D60008A08b1828E02120F1a952D295036eF3d",
      "chainId": 324,
      "decimals": 6,
      "logoURI": "https://tokens.pancakeswap.finance/images/zksync/0xBb8D60008A08b1828E02120F1a952D295036eF3d.png"
    },
    {
      "name": "Holdstation",
      "symbol": "HOLD",
      "address": "0xed4040fD47629e7c8FBB7DA76bb50B3e7695F0f2",
      "chainId": 324,
      "decimals": 18,
      "logoURI": "https://tokens.pancakeswap.finance/images/zksync/0xed4040fD47629e7c8FBB7DA76bb50B3e7695F0f2.png"
    },
    {
      "name": "zkSync",
      "symbol": "ZK",
      "address": "0x5A7d6b2F92C77FAD6CCaBd7EE0624E64907Eaf3E",
      "chainId": 324,
      "decimals": 18,
      "logoURI": "https://tokens.pancakeswap.finance/images/zksync/0x5A7d6b2F92C77FAD6CCaBd7EE0624E64907Eaf3E.png"
    },
    {
      "name": "ZKE",
      "symbol": "ZKE",
      "address": "0x7b3e1236c39ddD2e61cF6Da6ac6D11193238ccB0",
      "chainId": 324,
      "decimals": 18,
      "logoURI": "https://tokens.pancakeswap.finance/images/zksync/0x7b3e1236c39ddD2e61cF6Da6ac6D11193238ccB0.png"
    },
    {
      "name": "ReactorFusion",
      "symbol": "RF",
      "address": "0x5f7CBcb391d33988DAD74D6Fd683AadDA1123E4D",
      "chainId": 324,
      "decimals": 18,
      "logoURI": "https://tokens.pancakeswap.finance/images/zksync/0x5f7CBcb391d33988DAD74D6Fd683AadDA1123E4D.png"
    }
  ]
}
