{
  "name": "PancakeSwap Base Default",
  "timestamp": "2024-09-12T15:43:00.411Z",
  "version": {
    "major": 0,
    "minor": 0,
    "patch": 17
  },
  "logoURI": "https://pancakeswap.finance/logo.png",
  "keywords": ["pancakeswap", "default", "base"],
  "tokens": [
    {
      "name": "Wrapped Ether",
      "symbol": "WETH",
      "address": "0x4200000000000000000000000000000000000006",
      "chainId": 8453,
      "decimals": 18,
      "logoURI": "https://tokens.pancakeswap.finance/images/symbol/weth.png"
    },
    {
      "name": "Base tBTC v2",
      "symbol": "tbtc",
      "address": "0x236aa50979D5f3De3Bd1Eeb40E81137F22ab794b",
      "chainId": 8453,
      "decimals": 18,
      "logoURI": "https://tokens.pancakeswap.finance/images/base/0x236aa50979D5f3De3Bd1Eeb40E81137F22ab794b.png"
    },
    {
      "name": "USD Base Coin",
      "symbol": "USDbC",
      "address": "0xd9aAEc86B65D86f6A7B5B1b0c42FFA531710b6CA",
      "chainId": 8453,
      "decimals": 6,
      "logoURI": "https://tokens.pancakeswap.finance/images/base/0xd9aAEc86B65D86f6A7B5B1b0c42FFA531710b6CA.png"
    },
    {
      "name": "USD Coin",
      "symbol": "USDC",
      "address": "0x833589fCD6eDb6E08f4c7C32D4f71b54bdA02913",
      "chainId": 8453,
      "decimals": 6,
      "logoURI": "https://tokens.pancakeswap.finance/images/symbol/usdc.png"
    },
    {
      "name": "Dai Stablecoin",
      "symbol": "DAI",
      "address": "0x50c5725949A6F0c72E6C4a641F24049A917DB0Cb",
      "chainId": 8453,
      "decimals": 18,
      "logoURI": "https://tokens.pancakeswap.finance/images/symbol/dai.png"
    },
    {
      "name": "Coinbase Wrapped Staked ETH",
      "symbol": "cbETH",
      "address": "0x2Ae3F1Ec7F1F5012CFEab0185bfc7aa3cf0DEc22",
      "chainId": 8453,
      "decimals": 18,
      "logoURI": "https://tokens.pancakeswap.finance/images/base/0x2Ae3F1Ec7F1F5012CFEab0185bfc7aa3cf0DEc22.png"
    },
    {
      "name": "Axelar Wrapped USDC",
      "symbol": "axlUSDC",
      "address": "0xEB466342C4d449BC9f53A865D5Cb90586f405215",
      "chainId": 8453,
      "decimals": 6,
      "logoURI": "https://tokens.pancakeswap.finance/images/base/0xEB466342C4d449BC9f53A865D5Cb90586f405215.png"
    },
    {
      "name": "SABLE",
      "symbol": "SABLE",
      "address": "0xE5393cdBC4Fe7B62F1d76A990Ca7Da17ad718313",
      "chainId": 8453,
      "decimals": 18,
      "logoURI": "https://tokens.pancakeswap.finance/images/base/0xE5393cdBC4Fe7B62F1d76A990Ca7Da17ad718313.png"
    },
    {
      "name": "PancakeSwap Token",
      "symbol": "CAKE",
      "address": "0x3055913c90Fcc1A6CE9a358911721eEb942013A1",
      "chainId": 8453,
      "decimals": 18,
      "logoURI": "https://tokens.pancakeswap.finance/images/base/0x3055913c90Fcc1A6CE9a358911721eEb942013A1.png"
    },
    {
      "name": "Wrapped liquid staked Ether 2.0",
      "symbol": "wstETH",
      "address": "0xc1CBa3fCea344f92D9239c08C0568f6F2F0ee452",
      "chainId": 8453,
      "decimals": 18,
      "logoURI": "https://tokens.pancakeswap.finance/images/base/0xc1CBa3fCea344f92D9239c08C0568f6F2F0ee452.png"
    },
    {
      "name": "USD+",
      "symbol": "USD+",
      "address": "0xB79DD08EA68A908A97220C76d19A6aA9cBDE4376",
      "chainId": 8453,
      "decimals": 6,
      "logoURI": "https://tokens.pancakeswap.finance/images/base/0xB79DD08EA68A908A97220C76d19A6aA9cBDE4376.png"
    },
    {
      "name": "Brett",
      "symbol": "BRETT",
      "address": "0x532f27101965dd16442E59d40670FaF5eBB142E4",
      "chainId": 8453,
      "decimals": 18,
      "logoURI": "https://tokens.pancakeswap.finance/images/base/0x532f27101965dd16442E59d40670FaF5eBB142E4.png"
    },
    {
      "name": "Degen",
      "symbol": "DEGEN",
      "address": "0x4ed4E862860beD51a9570b96d89aF5E1B0Efefed",
      "chainId": 8453,
      "decimals": 18,
      "logoURI": "https://tokens.pancakeswap.finance/images/base/0x4ed4E862860beD51a9570b96d89aF5E1B0Efefed.png"
    },
    {
      "name": "Aerodrome",
      "symbol": "AERO",
      "address": "0x940181a94A35A4569E4529A3CDfB74e38FD98631",
      "chainId": 8453,
      "decimals": 18,
      "logoURI": "https://tokens.pancakeswap.finance/images/base/0x940181a94A35A4569E4529A3CDfB74e38FD98631.png"
    },
    {
      "name": "OVN",
      "symbol": "OVN",
      "address": "0xA3d1a8DEB97B111454B294E2324EfAD13a9d8396",
      "chainId": 8453,
      "decimals": 18,
      "logoURI": "https://tokens.pancakeswap.finance/images/base/0xA3d1a8DEB97B111454B294E2324EfAD13a9d8396.png"
    },
    {
      "name": "LayerZero",
      "symbol": "ZRO",
      "address": "0x6985884C4392D348587B19cb9eAAf157F13271cd",
      "chainId": 8453,
      "decimals": 18,
      "logoURI": "https://tokens.pancakeswap.finance/images/base/0x6985884C4392D348587B19cb9eAAf157F13271cd.png"
    },
    {
      "name": "Tether USDT",
      "symbol": "USDT",
      "address": "0xfde4C96c8593536E31F229EA8f37b2ADa2699bb2",
      "chainId": 8453,
      "decimals": 6,
      "logoURI": "https://tokens.pancakeswap.finance/images/symbol/usdt.png"
    },
    {
      "name": "Wrapped eETH",
      "symbol": "weETH",
      "address": "0x04C0599Ae5A44757c0af6F9eC3b93da8976c150A",
      "chainId": 8453,
      "decimals": 18,
      "logoURI": "https://tokens.pancakeswap.finance/images/base/0x04C0599Ae5A44757c0af6F9eC3b93da8976c150A.png"
    },
    {
      "name": "Master Miggles",
      "symbol": "MIGGLES",
      "address": "0xB1a03EdA10342529bBF8EB700a06C60441fEf25d",
      "chainId": 8453,
      "decimals": 18,
      "logoURI": "https://tokens.pancakeswap.finance/images/base/0xB1a03EdA10342529bBF8EB700a06C60441fEf25d.png"
    },
    {
      "name": "USDz",
      "symbol": "USDz",
      "address": "0x04D5ddf5f3a8939889F11E97f8c4BB48317F1938",
      "chainId": 8453,
      "decimals": 18,
      "logoURI": "https://tokens.pancakeswap.finance/images/base/0x04D5ddf5f3a8939889F11E97f8c4BB48317F1938.png"
    },
    {
      "name": "dogwifhat",
      "symbol": "WIF",
      "address": "0x1fba65dE0a9cBD2D1DF82d141897042d36Bb6c86",
      "chainId": 8453,
      "decimals": 18,
      "logoURI": "https://tokens.pancakeswap.finance/images/base/0x1fba65dE0a9cBD2D1DF82d141897042d36Bb6c86.png"
    },
    {
      "name": "Wormhole Wrapped USDT",
      "symbol": "wxUSDT",
      "address": "0xFf0C62A4979400841eFaA6faADb07Ac7d5C98b27",
      "chainId": 8453,
      "decimals": 6,
      "logoURI": "https://tokens.pancakeswap.finance/images/base/0xFf0C62A4979400841eFaA6faADb07Ac7d5C98b27.png"
    },
    {
      "name": "Dola USD Stablecoin",
      "symbol": "DOLA",
      "address": "0x4621b7A9c75199271F773Ebd9A499dbd165c3191",
      "chainId": 8453,
      "decimals": 18,
      "logoURI": "https://tokens.pancakeswap.finance/images/base/0x4621b7A9c75199271F773Ebd9A499dbd165c3191.png"
    },
    {
      "name": "Renzo Restaked ETH",
      "symbol": "ezETH",
      "address": "0x2416092f143378750bb29b79eD961ab195CcEea5",
      "chainId": 8453,
      "decimals": 18,
      "logoURI": "https://tokens.pancakeswap.finance/images/base/0x2416092f143378750bb29b79eD961ab195CcEea5.png"
    },
    {
      "name": "Mog Coin",
      "symbol": "MOG",
      "address": "0x2Da56AcB9Ea78330f947bD57C54119Debda7AF71",
      "chainId": 8453,
      "decimals": 18,
      "logoURI": "https://tokens.pancakeswap.finance/images/base/0x2Da56AcB9Ea78330f947bD57C54119Debda7AF71.png"
    },
    {
      "name": "Electronic Dollar",
      "symbol": "eUSD",
      "address": "0xCfA3Ef56d303AE4fAabA0592388F19d7C3399FB4",
      "chainId": 8453,
      "decimals": 18,
      "logoURI": "https://tokens.pancakeswap.finance/images/base/0xCfA3Ef56d303AE4fAabA0592388F19d7C3399FB4.png"
    },
    {
      "name": "Coinbase Wrapped BTC",
      "symbol": "cbBTC",
      "address": "0xcbB7C0000aB88B473b1f5aFd9ef808440eed33Bf",
      "chainId": 8453,
      "decimals": 8,
      "logoURI": "https://tokens.pancakeswap.finance/images/base/0xcbB7C0000aB88B473b1f5aFd9ef808440eed33Bf.png"
    }
  ]
}
