{
  "name": "PancakeSwap Scroll Default",
  "timestamp": "2023-10-18T06:20:04.942Z",
  "version": {
    "major": 0,
    "minor": 0,
    "patch": 4
  },
  "logoURI": "https://pancakeswap.finance/logo.png",
  "keywords": ["pancakeswap", "default", "scroll"],
  "tokens": [
    {
      "name": "Wrapped Ether",
      "symbol": "WETH",
      "address": "0x5300000000000000000000000000000000000004",
      "chainId": 534352,
      "decimals": 18,
      "logoURI": "https://tokens.pancakeswap.finance/images/symbol/weth.png"
    },
    {
      "name": "Wrapped BTC",
      "symbol": "WBTC",
      "address": "0x3C1BCa5a656e69edCD0D4E36BEbb3FcDAcA60Cf1",
      "chainId": 534352,
      "decimals": 8,
      "logoURI": "https://tokens.pancakeswap.finance/images/symbol/wbtc.png"
    },
    {
      "name": "Tether USD",
      "symbol": "USDT",
      "address": "0xf55BEC9cafDbE8730f096Aa55dad6D22d44099Df",
      "chainId": 534352,
      "decimals": 6,
      "logoURI": "https://tokens.pancakeswap.finance/images/symbol/usdt.png"
    },
    {
      "name": "USD Coin",
      "symbol": "USDC",
      "address": "0x06eFdBFf2a14a7c8E15944D1F4A48F9F95F663A4",
      "chainId": 534352,
      "decimals": 6,
      "logoURI": "https://tokens.pancakeswap.finance/images/symbol/usdc.png"
    }
  ]
}
