{
  "name": "PancakeSwap Aptos",
  "timestamp": "2025-01-15T01:44:00.049Z",
  "version": {
    "major": 0,
    "minor": 0,
    "patch": 27
  },
  "logoURI": "https://pancakeswap.finance/logo.png",
  "keywords": ["pancakeswap", "aptos"],
  "schema": "aptos",
  "tokens": [
    {
      "name": "PancakeSwap Token",
      "symbol": "CAKE",
      "chainId": 1,
      "decimals": 8,
      "address": "0x159df6b7689437016108a019fd5bef736bac692b6d4a1f10c941f6fbb9a74ca6::oft::CakeOFT",
      "logoURI": "https://tokens.pancakeswap.finance/images/aptos/0x159df6b7689437016108a019fd5bef736bac692b6d4a1f10c941f6fbb9a74ca6::oft::CakeOFT.png"
    },
    {
      "name": "Aptos Bitcoin",
      "symbol": "aBTC",
      "chainId": 1,
      "decimals": 8,
      "address": "0x4e1854f6d332c9525e258fb6e66f84b6af8aba687bbcb832a24768c4e175feec::abtc::ABTC",
      "logoURI": "https://tokens.pancakeswap.finance/images/0x4e1854f6d332c9525e258fb6e66f84b6af8aba687bbcb832a24768c4e175feec::abtc::ABTC.png"
    },
    {
      "name": "Amnis Finance",
      "symbol": "amAPT",
      "chainId": 1,
      "decimals": 8,
      "address": "0x111ae3e5bc816a5e63c2da97d0aa3886519e0cd5e4b046659fa35796bd11542a::amapt_token::AmnisApt",
      "logoURI": "https://tokens.pancakeswap.finance/images/aptos/0x111ae3e5bc816a5e63c2da97d0aa3886519e0cd5e4b046659fa35796bd11542a::amapt_token::AmnisApt.png"
    },
    {
      "name": "Aptos Coin",
      "symbol": "APT",
      "chainId": 1,
      "decimals": 8,
      "address": "0x1::aptos_coin::AptosCoin",
      "logoURI": "https://tokens.pancakeswap.finance/images/symbol/apt.png"
    },
    {
      "name": "Blocto Token",
      "symbol": "BLT",
      "chainId": 1,
      "decimals": 8,
      "address": "0xfbab9fb68bd2103925317b6a540baa20087b1e7a7a4eb90badee04abb6b5a16f::blt::Blt",
      "logoURI": "https://tokens.pancakeswap.finance/images/aptos/0xfbab9fb68bd2103925317b6a540baa20087b1e7a7a4eb90badee04abb6b5a16f::blt::Blt.png"
    },
    {
      "name": "Celer - Binance Coin",
      "symbol": "ceBNB",
      "chainId": 1,
      "decimals": 8,
      "address": "0x8d87a65ba30e09357fa2edea2c80dbac296e5dec2b18287113500b902942929d::celer_coin_manager::BnbCoin",
      "logoURI": "https://tokens.pancakeswap.finance/images/symbol/bnb.png"
    },
    {
      "name": "Celer - Binance USD",
      "symbol": "ceBUSD",
      "chainId": 1,
      "decimals": 8,
      "address": "0x8d87a65ba30e09357fa2edea2c80dbac296e5dec2b18287113500b902942929d::celer_coin_manager::BusdCoin",
      "logoURI": "https://tokens.pancakeswap.finance/images/symbol/busd.png"
    },
    {
      "name": "Celer - Dai Stablecoin",
      "symbol": "ceDAI",
      "chainId": 1,
      "decimals": 8,
      "address": "0x8d87a65ba30e09357fa2edea2c80dbac296e5dec2b18287113500b902942929d::celer_coin_manager::DaiCoin",
      "logoURI": "https://tokens.pancakeswap.finance/images/symbol/dai.png"
    },
    {
      "name": "Celer - USD Coin",
      "symbol": "ceUSDC",
      "chainId": 1,
      "decimals": 6,
      "address": "0x8d87a65ba30e09357fa2edea2c80dbac296e5dec2b18287113500b902942929d::celer_coin_manager::UsdcCoin",
      "logoURI": "https://tokens.pancakeswap.finance/images/symbol/usdc.png"
    },
    {
      "name": "Celer - Tether USD",
      "symbol": "ceUSDT",
      "chainId": 1,
      "decimals": 6,
      "address": "0x8d87a65ba30e09357fa2edea2c80dbac296e5dec2b18287113500b902942929d::celer_coin_manager::UsdtCoin",
      "logoURI": "https://tokens.pancakeswap.finance/images/symbol/usdt.png"
    },
    {
      "name": "Celer - Wrapped BTC",
      "symbol": "ceWBTC",
      "chainId": 1,
      "decimals": 8,
      "address": "0x8d87a65ba30e09357fa2edea2c80dbac296e5dec2b18287113500b902942929d::celer_coin_manager::WbtcCoin",
      "logoURI": "https://tokens.pancakeswap.finance/images/symbol/wbtc.png"
    },
    {
      "name": "Celer - Wrapped Ether",
      "symbol": "ceWETH",
      "chainId": 1,
      "decimals": 8,
      "address": "0x8d87a65ba30e09357fa2edea2c80dbac296e5dec2b18287113500b902942929d::celer_coin_manager::WethCoin",
      "logoURI": "https://tokens.pancakeswap.finance/images/symbol/weth.png"
    },
    {
      "name": "GUI INU",
      "symbol": "GUI",
      "chainId": 1,
      "decimals": 6,
      "address": "0xe4ccb6d39136469f376242c31b34d10515c8eaaa38092f804db8e08a8f53c5b2::assets_v1::EchoCoin002",
      "logoURI": "https://tokens.pancakeswap.finance/images/aptos/0xe4ccb6d39136469f376242c31b34d10515c8eaaa38092f804db8e08a8f53c5b2::assets_v1::EchoCoin002"
    },
    {
      "name": "LayerZero - USD Coin",
      "symbol": "lzUSDC",
      "chainId": 1,
      "decimals": 6,
      "address": "0xf22bede237a07e121b56d91a491eb7bcdfd1f5907926a9e58338f964a01b17fa::asset::USDC",
      "logoURI": "https://tokens.pancakeswap.finance/images/symbol/usdc.png"
    },
    {
      "name": "LayerZero - Tether USD",
      "symbol": "lzUSDT",
      "chainId": 1,
      "decimals": 6,
      "address": "0xf22bede237a07e121b56d91a491eb7bcdfd1f5907926a9e58338f964a01b17fa::asset::USDT",
      "logoURI": "https://tokens.pancakeswap.finance/images/symbol/usdt.png"
    },
    {
      "name": "LayerZero - Wrapped Ether",
      "symbol": "lzWETH",
      "chainId": 1,
      "decimals": 6,
      "address": "0xf22bede237a07e121b56d91a491eb7bcdfd1f5907926a9e58338f964a01b17fa::asset::WETH",
      "logoURI": "https://tokens.pancakeswap.finance/images/symbol/weth.png"
    },
    {
      "name": "Meeiro",
      "symbol": "MEE",
      "chainId": 1,
      "decimals": 6,
      "address": "0xe9c192ff55cffab3963c695cff6dbf9dad6aff2bb5ac19a6415cad26a81860d9::mee_coin::MeeCoin",
      "logoURI": "https://tokens.pancakeswap.finance/images/aptos/0xe9c192ff55cffab3963c695cff6dbf9dad6aff2bb5ac19a6415cad26a81860d9::mee_coin::MeeCoin.png"
    },
    {
      "name": "MOD Token",
      "symbol": "MOD",
      "chainId": 1,
      "decimals": 8,
      "address": "0x6f986d146e4a90b828d8c12c14b6f4e003fdff11a8eecceceb63744363eaac01::mod_coin::MOD",
      "logoURI": "https://tokens.pancakeswap.finance/images/aptos/0x6f986d146e4a90b828d8c12c14b6f4e003fdff11a8eecceceb63744363eaac01::mod_coin::MOD.png"
    },
    {
      "name": "Mojito",
      "symbol": "MOJO",
      "chainId": 1,
      "decimals": 8,
      "address": "0x881ac202b1f1e6ad4efcff7a1d0579411533f2502417a19211cfc49751ddb5f4::coin::MOJO",
      "logoURI": "https://tokens.pancakeswap.finance/images/aptos/0x881ac202b1f1e6ad4efcff7a1d0579411533f2502417a19211cfc49751ddb5f4::coin::MOJO.png"
    },
    {
      "name": "MOOMOO Token",
      "symbol": "MOOMOO",
      "chainId": 1,
      "decimals": 8,
      "address": "0xc5fbbcc4637aeebb4e732767abee8a21f2b0776f73b73e16ce13e7d31d6700da::MOOMOO::MOOMOO",
      "logoURI": "https://tokens.pancakeswap.finance/images/aptos/0xc5fbbcc4637aeebb4e732767abee8a21f2b0776f73b73e16ce13e7d31d6700da::MOOMOO::MOOMOO.png"
    },
    {
      "name": "BlueMove",
      "symbol": "MOVE",
      "chainId": 1,
      "decimals": 8,
      "address": "0x27fafcc4e39daac97556af8a803dbb52bcb03f0821898dc845ac54225b9793eb::move_coin::MoveCoin",
      "logoURI": "https://tokens.pancakeswap.finance/images/aptos/0x27fafcc4e39daac97556af8a803dbb52bcb03f0821898dc845ac54225b9793eb::move_coin::MoveCoin.png"
    },
    {
      "name": "Ditto Staked Aptos",
      "symbol": "stAPT",
      "chainId": 1,
      "decimals": 8,
      "address": "0xd11107bdf0d6d7040c6c0bfbdecb6545191fdf13e8d8d259952f53e1713f61b5::staked_coin::StakedAptos",
      "logoURI": "https://tokens.pancakeswap.finance/images/aptos/0xd11107bdf0d6d7040c6c0bfbdecb6545191fdf13e8d8d259952f53e1713f61b5::staked_coin::StakedAptos.png"
    },
    {
      "name": "Amnis Staked Aptos",
      "symbol": "stAPT",
      "chainId": 1,
      "decimals": 8,
      "address": "0x111ae3e5bc816a5e63c2da97d0aa3886519e0cd5e4b046659fa35796bd11542a::stapt_token::StakedApt",
      "logoURI": "https://tokens.pancakeswap.finance/images/aptos/0x111ae3e5bc816a5e63c2da97d0aa3886519e0cd5e4b046659fa35796bd11542a::stapt_token::StakedApt"
    },
    {
      "name": "Tortuga Staked APT",
      "symbol": "tAPT",
      "chainId": 1,
      "decimals": 8,
      "address": "0x84d7aeef42d38a5ffc3ccef853e1b82e4958659d16a7de736a29c55fbbeb0114::staked_aptos_coin::StakedAptosCoin",
      "logoURI": "https://tokens.pancakeswap.finance/images/aptos/0x84d7aeef42d38a5ffc3ccef853e1b82e4958659d16a7de736a29c55fbbeb0114::staked_aptos_coin::StakedAptosCoin.png"
    },
    {
      "name": "Thala Token",
      "symbol": "THL",
      "chainId": 1,
      "decimals": 8,
      "address": "0x7fd500c11216f0fe3095d0c4b8aa4d64a4e2e04f83758462f2b127255643615::thl_coin::THL",
      "logoURI": "https://tokens.pancakeswap.finance/images/aptos/0x7fd500c11216f0fe3095d0c4b8aa4d64a4e2e04f83758462f2b127255643615::thl_coin::THL.png"
    },
    {
      "name": "Wormhole - Binance USD",
      "symbol": "whBUSD",
      "chainId": 1,
      "decimals": 8,
      "address": "0xccc9620d38c4f3991fa68a03ad98ef3735f18d04717cb75d7a1300dd8a7eed75::coin::T",
      "logoURI": "https://tokens.pancakeswap.finance/images/symbol/busd.png"
    },
    {
      "name": "Wormhole - USD Coin",
      "symbol": "whUSDC",
      "chainId": 1,
      "decimals": 6,
      "address": "0x5e156f1207d0ebfa19a9eeff00d62a282278fb8719f4fab3a586a0a2c0fffbea::coin::T",
      "logoURI": "https://tokens.pancakeswap.finance/images/symbol/usdc.png"
    },
    {
      "name": "Wormhole - Tether USD",
      "symbol": "whUSDT",
      "chainId": 1,
      "decimals": 6,
      "address": "0xa2eda21a58856fda86451436513b867c97eecb4ba099da5775520e0f7492e852::coin::T",
      "logoURI": "https://tokens.pancakeswap.finance/images/symbol/usdt.png"
    },
    {
      "name": "Wormhole - Wrapped Ether",
      "symbol": "whWETH",
      "chainId": 1,
      "decimals": 8,
      "address": "0xcc8a89c8dce9693d354449f1f73e60e14e347417854f029db5bc8e7454008abb::coin::T",
      "logoURI": "https://tokens.pancakeswap.finance/images/symbol/weth.png"
    }
  ]
}
