{
  "name": "PancakeSwap BNB Chain MM",
  "timestamp": "2023-06-29T21:24:06.707Z",
  "version": {
    "major": 0,
    "minor": 0,
    "patch": 4
  },
  "logoURI": "https://pancakeswap.finance/logo.png",
  "keywords": ["pancakeswap", "mm", "bnb"],
  "tokens": [
    {
      "name": "WBNB Token",
      "symbol": "WBNB",
      "address": "0xbb4CdB9CBd36B01bD1cBaEBF2De08d9173bc095c",
      "chainId": 56,
      "decimals": 18,
      "logoURI": "https://tokens.pancakeswap.finance/images/0xbb4CdB9CBd36B01bD1cBaEBF2De08d9173bc095c.png"
    },
    {
      "name": "Binance Pegged ETH",
      "symbol": "ETH",
      "address": "0x2170Ed0880ac9A755fd29B2688956BD959F933F8",
      "chainId": 56,
      "decimals": 18,
      "logoURI": "https://tokens.pancakeswap.finance/images/0x2170Ed0880ac9A755fd29B2688956BD959F933F8.png"
    },
    {
      "name": "Binance Pegged Bitcoin",
      "symbol": "BTCB",
      "address": "0x7130d2A12B9BCbFAe4f2634d864A1Ee1Ce3Ead9c",
      "chainId": 56,
      "decimals": 18,
      "logoURI": "https://tokens.pancakeswap.finance/images/0x7130d2A12B9BCbFAe4f2634d864A1Ee1Ce3Ead9c.png"
    },
    {
      "name": "Binance Pegged BUSD",
      "symbol": "BUSD",
      "address": "0xe9e7CEA3DedcA5984780Bafc599bD69ADd087D56",
      "chainId": 56,
      "decimals": 18,
      "logoURI": "https://tokens.pancakeswap.finance/images/0xe9e7CEA3DedcA5984780Bafc599bD69ADd087D56.png"
    },
    {
      "name": "Binance Pegged USDT",
      "symbol": "USDT",
      "address": "0x55d398326f99059fF775485246999027B3197955",
      "chainId": 56,
      "decimals": 18,
      "logoURI": "https://tokens.pancakeswap.finance/images/0x55d398326f99059fF775485246999027B3197955.png"
    },
    {
      "name": "Binance Pegged USD Coin",
      "symbol": "USDC",
      "address": "0x8AC76a51cc950d9822D68b83fE1Ad97B32Cd580d",
      "chainId": 56,
      "decimals": 18,
      "logoURI": "https://tokens.pancakeswap.finance/images/0x8AC76a51cc950d9822D68b83fE1Ad97B32Cd580d.png"
    },
    {
      "name": "ARB",
      "symbol": "Arbitrum",
      "address": "0xa050FFb3eEb8200eEB7F61ce34FF644420FD3522",
      "chainId": 56,
      "decimals": 18,
      "logoURI": "https://tokens.pancakeswap.finance/images/0xa050FFb3eEb8200eEB7F61ce34FF644420FD3522.png"
    },
    {
      "name": "Optimism",
      "symbol": "OP",
      "address": "0x170C84E3b1D282f9628229836086716141995200",
      "chainId": 56,
      "decimals": 18,
      "logoURI": "https://tokens.pancakeswap.finance/images/0x170C84E3b1D282f9628229836086716141995200.png"
    }
  ]
}
